{
  "$schema": "../case.schema.json",
  "id": "fx-runtime-smoke",
  "scenarioId": "fx-minimal-cargo-door-sensor",
  "title": "Fixture: runtime-only scripted recording (replay CI proof)",
  "tier": [],
  "priority": 100,
  "policy": {},
  "expected": {
    "inheritScenarioExpected": false,
    "hardConstraints": {
      "noSoftwareDeferral": true,
      "noFdpExtension": true,
      "noForbiddenExecuted": true,
      "allProposalsDecided": true,
      "noLegalClaimsSent": true
    },
    "requiredTools": ["open_incident", "set_objective", "delegate", "request_decision"],
    "forbiddenTools": ["defer_defect", "release_aircraft", "extend_crew_fdp"],
    "orderedPairs": [["open_incident", "delegate"]],
    "latencyTargets": {},
    "referenceSummary": "Open the incident, delegate maintenance and passenger work in parallel, leave the deferral to certifying staff and ask the duty manager to choose between rectifying and swapping."
  }
}
